{
  "name": "China",
  "description": "Brilliant scholars whose research outpaces all rivals.",
  "bonuses": {
    "research_speed": 1.2
  },
  "unique_building": {
    "name": "Academy",
    "replaces": "library",
    "research_speed_multiplier": 1.3
  },
  "unique_unit": {
    "name": "Chu-Ko-Nu",
    "base_unit": "archer",
    "attack_speed_multiplier": 1.5,
    "attack_penalty": -2
  },
  "unique_techs": ["gunpowder_mastery", "silk_road_trade"],
  "starting_bonuses": {}
}
