{
  "name": "Maya",
  "description": "Masters of the calendar whose knowledge of the cosmos accelerates their advancement.",
  "bonuses": {
    "knowledge_generation": 1.15,
    "age_advancement_cost": 0.85
  },
  "unique_building": {
    "name": "Observatory",
    "replaces": "library",
    "map_reveal_radius": 15
  },
  "unique_unit": {
    "name": "Atlatlist",
    "base_unit": "archer",
    "bonus_vs_infantry": 2.0
  },
  "unique_techs": ["long_count_calendar", "star_chart"],
  "starting_bonuses": {}
}
