{
  "name": "Egypt",
  "description": "Monument builders with unmatched defensive fortifications.",
  "bonuses": {
    "stone_gather_rate": 1.2
  },
  "unique_building": {
    "name": "Pyramid",
    "replaces": "wonder",
    "building_hp_multiplier": 1.3
  },
  "unique_unit": {
    "name": "War Chariot",
    "base_unit": "cavalry",
    "ranged_attack": 4,
    "range": 3,
    "hp_penalty": -10
  },
  "unique_techs": ["monument_building", "pharaoh_legacy"],
  "starting_bonuses": {}
}
